StepID	Type	LeanTarget	Commit	Notes
Q39.S24-2k-two-strip-interval-obstruction	Proof	formal/WIP/Work.lean	PENDING	frontier swap invariance lemma
Q39.S25-2k-two-strip-interval-rank-check	Proof	formal/WIP/Work.lean	PENDING	frontier cut separation lemma
Q39.S26-2k-two-strip-frontier-adj	Proof	formal/WIP/Work.lean	PENDING	frontier edges imply adjacency in symmetric graphs
Q43.S138-logn-nonimpact-check	Exact citation	formal/WIP/Work.lean	PENDING	HR'22: Thm 4.3 uses Thm 4.1 only for large M
Q39.S27-2k-two-strip-interval-rank-bound	Counterexample	formal/Notes/TseitinQ39.lean	PENDING	two-strip row-interval rank counterexample
Q39.S28-2k-two-strip-linked-intervals	Counterexample	formal/WIP/Work.lean	PENDING	linked two-strip row-intervals still give rank 2 (see formal/Notes/TseitinQ39.lean ยง16.169)
Q39.S29-2k-two-strip-rectangular-geometry	Counterexample	formal/Notes/TseitinQ39.lean	PENDING	two-strip rectangular geometry in a 2-column slab still gives rank 2
Q39.S30-2k-two-strip-anchored-rectangles	Counterexample	formal/Notes/TseitinQ39.lean	PENDING	two-strip anchored rectangles (prefix rows) still give rank 2
Q39.S31-2k-two-strip-prefix-chain	Counterexample	formal/Notes/TseitinQ39.lean	PENDING	prefix-chain of anchored rectangles still gives rank 2
Q39.S32-2k-two-strip-alternating-strip	Counterexample	formal/Notes/TseitinQ39.lean	PENDING	alternating-strip XOR step still gives rank 2
